{
  "$schema": "https://json-schema.org/draft/2020-12/schema",
  "$id": "https://frankenterm.dev/schemas/ft-mission-objective-plan.json",
  "title": "FrankenTerm Mission Objective Plan",
  "description": "Versioned dry-run contract for compiling an operator objective into a safe, auditable swarm mission plan.",
  "type": "object",
  "required": [
    "schema_version",
    "contract_id",
    "generated_at_ms",
    "objective",
    "plan_status",
    "source_snapshots",
    "capacity_admission",
    "steps",
    "proof_requirements",
    "forbidden_actions",
    "redaction_policy",
    "raw_pane_content_stored",
    "artifact_paths"
  ],
  "additionalProperties": false,
  "properties": {
    "schema_version": {
      "type": "integer",
      "const": 1
    },
    "contract_id": {
      "type": "string",
      "const": "ft.mission_objective_plan.v1"
    },
    "generated_at_ms": {
      "type": "integer",
      "minimum": 0
    },
    "objective": {
      "$ref": "#/$defs/objective"
    },
    "plan_status": {
      "$ref": "#/$defs/plan_status"
    },
    "source_snapshots": {
      "type": "array",
      "minItems": 1,
      "items": {
        "$ref": "#/$defs/source_snapshot"
      }
    },
    "capacity_admission": {
      "$ref": "#/$defs/capacity_admission"
    },
    "steps": {
      "type": "array",
      "items": {
        "$ref": "#/$defs/plan_step"
      }
    },
    "proof_requirements": {
      "type": "array",
      "items": {
        "$ref": "#/$defs/proof_requirement"
      }
    },
    "forbidden_actions": {
      "type": "array",
      "minItems": 1,
      "items": {
        "$ref": "#/$defs/forbidden_action"
      }
    },
    "redaction_policy": {
      "$ref": "#/$defs/redaction_policy"
    },
    "raw_pane_content_stored": {
      "type": "boolean",
      "const": false
    },
    "artifact_paths": {
      "$ref": "#/$defs/string_array"
    },
    "bead_work_selection": {
      "$ref": "#/$defs/bead_work_selection"
    }
  },
  "$defs": {
    "bead_id": {
      "type": "string",
      "minLength": 1,
      "maxLength": 128,
      "pattern": "^[A-Za-z0-9_.-]+$"
    },
    "bead_status": {
      "enum": ["open", "in_progress", "blocked", "deferred", "closed"]
    },
    "bead_exclusion": {
      "enum": ["closed", "deferred", "blocked_status", "active_ownership", "unfinished_dependency"]
    },
    "bead_ids": {
      "type": "array",
      "maxItems": 8192,
      "uniqueItems": true,
      "items": { "$ref": "#/$defs/bead_id" }
    },
    "bead_work_candidate": {
      "type": "object",
      "additionalProperties": false,
      "required": [
        "id",
        "status",
        "issue_type",
        "priority",
        "pagerank_billionths",
        "blocker_ids",
        "exclusions"
      ],
      "properties": {
        "id": { "$ref": "#/$defs/bead_id" },
        "status": { "$ref": "#/$defs/bead_status" },
        "issue_type": {
          "type": "string",
          "minLength": 1,
          "maxLength": 64,
          "pattern": "^[A-Za-z0-9_.-]+$"
        },
        "priority": { "type": "integer", "minimum": 0, "maximum": 4 },
        "pagerank_billionths": { "type": "integer", "minimum": 0, "maximum": 1000000000 },
        "blocker_ids": { "$ref": "#/$defs/bead_ids" },
        "exclusions": {
          "type": "array",
          "maxItems": 5,
          "uniqueItems": true,
          "items": { "$ref": "#/$defs/bead_exclusion" }
        }
      }
    },
    "bead_work_selection": {
      "type": "object",
      "description": "Advisory selection from every record in the exact supplied br JSONL export; file age and input hash do not establish current database state or ownership authority.",
      "additionalProperties": false,
      "required": [
        "schema_version",
        "input_format",
        "input_sha256",
        "source_bytes",
        "snapshot_modified_at_ms",
        "evaluated_at_ms",
        "live_database_validated",
        "node_count",
        "edge_count",
        "type_population",
        "status_population",
        "exclusion_population",
        "selected_id",
        "ordered_ready_ids",
        "candidates",
        "pagerank_iterations",
        "tie_break"
      ],
      "properties": {
        "schema_version": { "const": 1 },
        "input_format": { "const": "br-jsonl-v1" },
        "input_sha256": { "type": "string", "pattern": "^[0-9a-f]{64}$" },
        "source_bytes": { "type": "integer", "minimum": 0, "maximum": 67108864 },
        "snapshot_modified_at_ms": { "type": "integer", "minimum": 0 },
        "evaluated_at_ms": { "type": "integer", "minimum": 0 },
        "live_database_validated": { "const": false },
        "node_count": { "type": "integer", "minimum": 0, "maximum": 8192 },
        "edge_count": { "type": "integer", "minimum": 0, "maximum": 65536 },
        "type_population": {
          "type": "object",
          "maxProperties": 8192,
          "propertyNames": {
            "type": "string",
            "minLength": 1,
            "maxLength": 64,
            "pattern": "^[A-Za-z0-9_.-]+$"
          },
          "additionalProperties": { "type": "integer", "minimum": 1, "maximum": 8192 }
        },
        "status_population": {
          "type": "object",
          "propertyNames": { "$ref": "#/$defs/bead_status" },
          "additionalProperties": { "type": "integer", "minimum": 1, "maximum": 8192 }
        },
        "exclusion_population": {
          "type": "object",
          "propertyNames": { "$ref": "#/$defs/bead_exclusion" },
          "additionalProperties": { "type": "integer", "minimum": 1, "maximum": 8192 }
        },
        "selected_id": {
          "anyOf": [{ "$ref": "#/$defs/bead_id" }, { "type": "null" }]
        },
        "ordered_ready_ids": { "$ref": "#/$defs/bead_ids" },
        "candidates": {
          "type": "array",
          "maxItems": 8192,
          "items": { "$ref": "#/$defs/bead_work_candidate" }
        },
        "pagerank_iterations": { "type": "integer", "minimum": 0, "maximum": 100 },
        "tie_break": { "const": "priority_ascending,pagerank_billionths_descending,id_ascending" }
      }
    },
    "string_array": {
      "type": "array",
      "items": {
        "type": "string",
        "minLength": 1
      }
    },
    "objective": {
      "type": "object",
      "required": [
        "objective_id",
        "requested_by",
        "summary",
        "workspace_root",
        "target_bead_ids",
        "allowed_action_classes",
        "forbidden_action_classes",
        "freshness_budget_ms",
        "proof_strictness"
      ],
      "additionalProperties": false,
      "properties": {
        "objective_id": {
          "type": "string",
          "minLength": 1
        },
        "requested_by": {
          "type": "string",
          "minLength": 1
        },
        "summary": {
          "type": "string",
          "minLength": 1
        },
        "workspace_root": {
          "type": "string",
          "minLength": 1
        },
        "target_bead_ids": {
          "$ref": "#/$defs/string_array"
        },
        "allowed_action_classes": {
          "type": "array",
          "items": {
            "$ref": "#/$defs/action_class"
          }
        },
        "forbidden_action_classes": {
          "type": "array",
          "items": {
            "$ref": "#/$defs/action_class"
          }
        },
        "freshness_budget_ms": {
          "type": "integer",
          "minimum": 0
        },
        "proof_strictness": {
          "$ref": "#/$defs/proof_strictness"
        }
      }
    },
    "action_class": {
      "type": "string",
      "enum": [
        "read_status",
        "claim_bead",
        "add_beads_comment",
        "create_bead",
        "edit_files",
        "run_static_check",
        "run_rch_proof",
        "request_approval",
        "wait",
        "local_cargo_proof",
        "raw_pane_content",
        "pane_mutation",
        "service_mutation",
        "destructive_filesystem"
      ]
    },
    "proof_strictness": {
      "type": "string",
      "enum": [
        "static_only",
        "rch_required",
        "target_hardware_required",
        "blocked_until_proof_available"
      ]
    },
    "plan_status": {
      "type": "string",
      "enum": [
        "actionable",
        "planning_only",
        "blocked",
        "waiting_owner",
        "waiting_external",
        "dirty_overlap",
        "no_ready_work",
        "rch_substrate_blocked",
        "degraded",
        "unavailable"
      ]
    },
    "source_kind": {
      "type": "string",
      "enum": [
        "beads",
        "agent_mail",
        "rch",
        "git",
        "robot",
        "blocker_radar",
        "resource_cockpit",
        "manual",
        "fixture"
      ]
    },
    "source_state": {
      "type": "string",
      "enum": ["available", "degraded", "unavailable", "stale", "blocked"]
    },
    "source_snapshot": {
      "type": "object",
      "required": [
        "source_id",
        "source_kind",
        "state",
        "collected_at_ms",
        "freshness_ms",
        "freshness_state",
        "command_or_api",
        "redacted",
        "redaction_posture",
        "raw_pane_content_stored",
        "reason_codes",
        "evidence",
        "artifact_paths"
      ],
      "additionalProperties": false,
      "properties": {
        "source_id": {
          "type": "string",
          "minLength": 1
        },
        "source_kind": {
          "$ref": "#/$defs/source_kind"
        },
        "state": {
          "$ref": "#/$defs/source_state"
        },
        "collected_at_ms": {
          "type": ["integer", "null"],
          "minimum": 0
        },
        "freshness_ms": {
          "type": ["integer", "null"],
          "minimum": 0
        },
        "freshness_state": {
          "$ref": "#/$defs/freshness_state"
        },
        "command_or_api": {
          "type": "string",
          "minLength": 1
        },
        "redacted": {
          "type": "boolean",
          "const": true
        },
        "redaction_posture": {
          "$ref": "#/$defs/redaction_posture"
        },
        "raw_pane_content_stored": {
          "type": "boolean",
          "const": false
        },
        "reason_codes": {
          "$ref": "#/$defs/string_array"
        },
        "evidence": {
          "type": "array",
          "minItems": 1,
          "items": {
            "$ref": "#/$defs/source_evidence"
          }
        },
        "artifact_paths": {
          "$ref": "#/$defs/string_array"
        }
      }
    },
    "freshness_state": {
      "type": "string",
      "enum": ["fresh", "within_budget", "stale", "unknown", "not_collected"]
    },
    "redaction_posture": {
      "type": "object",
      "required": ["pane_content", "secret_material", "notes"],
      "additionalProperties": false,
      "properties": {
        "pane_content": {
          "type": "string",
          "enum": ["not_collected", "redacted", "not_applicable", "raw_forbidden"]
        },
        "secret_material": {
          "type": "string",
          "enum": ["not_collected", "redacted", "not_applicable", "raw_forbidden"]
        },
        "notes": {
          "$ref": "#/$defs/string_array"
        }
      }
    },
    "source_evidence_category": {
      "type": "string",
      "enum": [
        "beads_ready_queue",
        "beads_blocked_queue",
        "beads_in_progress",
        "active_assignee_overlap",
        "agent_mail_availability",
        "rch_worker_selection",
        "rch_active_project_exclusion",
        "rch_topology_preflight",
        "rch_cargo_verdict",
        "git_dirty_tree",
        "dirty_path_overlap",
        "capacity_pressure",
        "robot_inventory",
        "redaction_posture",
        "manual_note"
      ]
    },
    "source_evidence_state": {
      "type": "string",
      "enum": [
        "pass",
        "warn",
        "fail",
        "blocked",
        "unavailable",
        "stale",
        "unknown",
        "not_applicable"
      ]
    },
    "source_evidence": {
      "type": "object",
      "required": ["evidence_id", "category", "state", "subject", "reason_codes", "artifact_paths"],
      "additionalProperties": false,
      "properties": {
        "evidence_id": {
          "type": "string",
          "minLength": 1
        },
        "category": {
          "$ref": "#/$defs/source_evidence_category"
        },
        "state": {
          "$ref": "#/$defs/source_evidence_state"
        },
        "subject": {
          "type": "string",
          "minLength": 1
        },
        "reason_codes": {
          "$ref": "#/$defs/string_array"
        },
        "artifact_paths": {
          "$ref": "#/$defs/string_array"
        }
      }
    },
    "capacity_admission": {
      "type": "object",
      "required": ["action", "pressure_tier", "proof_state", "reason_codes"],
      "additionalProperties": false,
      "properties": {
        "action": {
          "type": "string",
          "enum": ["admit", "defer", "degrade", "shed", "unavailable"]
        },
        "pressure_tier": {
          "type": "string",
          "enum": ["green", "yellow", "orange", "red", "black", "unknown"]
        },
        "proof_state": {
          "type": "string",
          "enum": ["measured", "simulated", "stale", "unavailable", "not_required"]
        },
        "reason_codes": {
          "$ref": "#/$defs/string_array"
        }
      }
    },
    "side_effect_class": {
      "type": "string",
      "enum": [
        "none",
        "beads_metadata",
        "source_edit",
        "proof_run",
        "pane_mutation",
        "service_mutation",
        "destructive"
      ]
    },
    "plan_step": {
      "type": "object",
      "required": [
        "step_id",
        "rank",
        "action_kind",
        "status",
        "target",
        "side_effect_class",
        "requires_approval",
        "forbidden",
        "reason_codes",
        "proof_requirement_ids"
      ],
      "additionalProperties": false,
      "properties": {
        "step_id": {
          "type": "string",
          "minLength": 1
        },
        "rank": {
          "type": "integer",
          "minimum": 0
        },
        "action_kind": {
          "type": "string",
          "enum": [
            "choose_ready_bead",
            "claim_bead",
            "add_beads_comment",
            "create_bead",
            "run_static_check",
            "run_rch_proof",
            "inspect_artifact",
            "wait_for_owner",
            "request_approval",
            "no_op"
          ]
        },
        "status": {
          "$ref": "#/$defs/plan_status"
        },
        "target": {
          "type": "string",
          "minLength": 1
        },
        "side_effect_class": {
          "$ref": "#/$defs/side_effect_class"
        },
        "requires_approval": {
          "type": "boolean"
        },
        "forbidden": {
          "type": "boolean"
        },
        "reason_codes": {
          "$ref": "#/$defs/string_array"
        },
        "proof_requirement_ids": {
          "$ref": "#/$defs/string_array"
        }
      }
    },
    "proof_requirement": {
      "type": "object",
      "required": ["proof_id", "proof_kind", "required", "status", "command", "artifact_paths"],
      "additionalProperties": false,
      "properties": {
        "proof_id": {
          "type": "string",
          "minLength": 1
        },
        "proof_kind": {
          "type": "string",
          "enum": [
            "static_json",
            "static_schema",
            "golden_fixture",
            "rch_cargo",
            "target_hardware",
            "manual_review"
          ]
        },
        "required": {
          "type": "boolean"
        },
        "status": {
          "type": "string",
          "enum": ["pending", "passed", "failed", "blocked", "not_required"]
        },
        "command": {
          "type": "string",
          "minLength": 1
        },
        "artifact_paths": {
          "$ref": "#/$defs/string_array"
        }
      }
    },
    "forbidden_action": {
      "type": "object",
      "required": ["action_class", "reason"],
      "additionalProperties": false,
      "properties": {
        "action_class": {
          "$ref": "#/$defs/action_class"
        },
        "reason": {
          "type": "string",
          "minLength": 1
        }
      }
    },
    "redaction_policy": {
      "type": "object",
      "required": ["policy_id", "raw_pane_content_allowed", "secret_material_allowed", "notes"],
      "additionalProperties": false,
      "properties": {
        "policy_id": {
          "type": "string",
          "minLength": 1
        },
        "raw_pane_content_allowed": {
          "type": "boolean",
          "const": false
        },
        "secret_material_allowed": {
          "type": "boolean",
          "const": false
        },
        "notes": {
          "$ref": "#/$defs/string_array"
        }
      }
    }
  }
}
